{"accountable_subject":"acct:github.com/raphaelperrut","attestation_id":"task-0738-a5a7707921034d498a8e03520d3fe3ef","binding":{"binding_id":"task-0738-solo-qa","binding_version":"2.0.0","digest_sha256":"6263cd9e5ab2e21266438cce8bc47370a6d8f1e9136a392f2a09f42140476f63"},"candidate_sha":"e14f7e4f23a8bb4e7d16827d9cb2312a1d03d912","decision":"APPROVE","functional_session":{"input_snapshot_digest_sha256":"f84908d577debb9bc3a4d014b8411d3b548648aebf97dcf63284868dba177270","predecessor_attestation_digest_sha256":"b5200ee0e2aaf44c744231e07ea54b576d6cab32a7600f5e3f5cd6da303070c8","role":"QA","sequence":2,"session_id":"task-0738-4edb1716f8d64891ac443e1c12c60e77","started_at":"2026-10-03T23:59:01.334482Z","verifier_input_set_digest_sha256":null},"governance_mode":"SOLO_FUNCTIONAL_SEGREGATION_V1","issued_at":"2026-10-03T23:59:01.334482Z","personal_independence":"ABSENT_DECLARED","policy":{"profile_id":"dsgeorref-daa-operational","profile_version":"2.0.0"},"principal":{"issuer":"https://github.com","subject":"raphaelperrut"},"role":"QA","schema_version":"2.0.0","signature":{"algorithm":"Ed25519","key_id":"daa2-operational-qa-2026","message_profile":"DSGEOREF-DELIVERY-APPROVAL-ATTESTATION-V2","value":"G6uMoY3NwUe5AFpl2ZMNdLeicZbRo7A_8zUBtSz5BjX7RpKiW_VVLj5NE5Sy75FbgeJG7QrFPT0yg81skSDAAg"},"task_envelope":{"digest_sha256":"f84908d577debb9bc3a4d014b8411d3b548648aebf97dcf63284868dba177270","task_id":"TASK-0738"},"trust_scope":"DSGEOREF-DELIVERY-APPROVAL-AUTHORITY-V1"}