{"accountable_subject":"acct:github.com/raphaelperrut","attestation_id":"task-0738-592aedac470f4cffa8dc9f4f00b4b0a3","binding":{"binding_id":"task-0738-solo-executor","binding_version":"2.0.0","digest_sha256":"79255f8f3e0095a351e7d99af6ac0c42d9efe65a5af50fc5149ee065b972f2ff"},"candidate_sha":"e14f7e4f23a8bb4e7d16827d9cb2312a1d03d912","decision":"DELIVERED","functional_session":{"input_snapshot_digest_sha256":"f84908d577debb9bc3a4d014b8411d3b548648aebf97dcf63284868dba177270","predecessor_attestation_digest_sha256":null,"role":"Executor","sequence":1,"session_id":"task-0738-136bd1fc9c7540aaa6b196bd4065eb1d","started_at":"2026-10-03T23:53:45.222784Z","verifier_input_set_digest_sha256":null},"governance_mode":"SOLO_FUNCTIONAL_SEGREGATION_V1","issued_at":"2026-10-03T23:53:45.222784Z","personal_independence":"ABSENT_DECLARED","policy":{"profile_id":"dsgeorref-daa-operational","profile_version":"2.0.0"},"principal":{"issuer":"https://github.com","subject":"raphaelperrut"},"role":"Executor","schema_version":"2.0.0","signature":{"algorithm":"Ed25519","key_id":"daa2-operational-executor-2026","message_profile":"DSGEOREF-DELIVERY-APPROVAL-ATTESTATION-V2","value":"CfxpPqSTb-BWQlef_714iWp5O4Y2AeyRWGDtenRh121cdrBr8h5zpl01Xowh7d0As0ZBUV6j6s-UXw2DXQVaBQ"},"task_envelope":{"digest_sha256":"f84908d577debb9bc3a4d014b8411d3b548648aebf97dcf63284868dba177270","task_id":"TASK-0738"},"trust_scope":"DSGEOREF-DELIVERY-APPROVAL-AUTHORITY-V1"}